[
  {
    "id": "0b17f82f-8af5-43d1-81ef-4263e0e32ff3",
    "latitude": 37.484292,
    "longitude": 126.819464,
    "coord_source": "manual_pin",
    "address": "서울 구로구 연동로13길 25 (서울수목원 현대홈타운스위트)",
    "detail_location": "현대홈타운스위트 단지 안 · 104동 어린이놀이터",
    "district": "구로구",
    "area": "hangdong",
    "place_type": "other",
    "bin_type": "other",
    "waste_kind": "general",
    "pet_waste_status": "allowed",
    "bag_available": "unknown",
    "source": "field_survey",
    "source_ref": "SURVEY-2026-001",
    "source_date": "2026-10-10",
    "status": "active",
    "last_verified_at": "2026-10-10T00:00:00+09:00",
    "photo_url": "/photos/bins/hometown-bench.jpg",
    "note": "운영자 현장 확인으로 배변봉투 가능. 위치는 운영자가 표시한 단지 지도를 위성사진에 맞춰 찍음 (오차 약 10~20m)",
    "created_at": "2026-10-10T17:10:00+09:00",
    "updated_at": "2026-10-10T18:00:00+09:00"
  },
  {
    "id": "f3b5e85d-e9c9-4ff2-bdd5-0917e6c55527",
    "latitude": 37.484928,
    "longitude": 126.820059,
    "coord_source": "manual_pin",
    "address": "서울 구로구 연동로13길 25 (서울수목원 현대홈타운스위트)",
    "detail_location": "현대홈타운스위트 단지 안 · 정문 경비실 옆",
    "district": "구로구",
    "area": "hangdong",
    "place_type": "other",
    "bin_type": "other",
    "waste_kind": "general",
    "pet_waste_status": "allowed",
    "bag_available": "unknown",
    "source": "field_survey",
    "source_ref": "SURVEY-2026-002",
    "source_date": "2026-10-10",
    "status": "active",
    "last_verified_at": "2026-10-10T00:00:00+09:00",
    "photo_url": "/photos/bins/hometown-fence.jpg",
    "note": "운영자 현장 확인으로 배변봉투 가능. 위치는 운영자가 표시한 단지 지도를 위성사진에 맞춰 찍음 (오차 약 10~20m)",
    "created_at": "2026-10-10T17:10:00+09:00",
    "updated_at": "2026-10-10T18:00:00+09:00"
  },
  {
    "id": "7dbfafac-6fd0-4388-b4d4-af7ef6f4f968",
    "latitude": 37.484119,
    "longitude": 126.820866,
    "coord_source": "manual_pin",
    "address": "서울 구로구 연동로13길 25 (서울수목원 현대홈타운스위트)",
    "detail_location": "현대홈타운스위트 단지 안 · 109동 앞 (의류수거함 옆)",
    "district": "구로구",
    "area": "hangdong",
    "place_type": "other",
    "bin_type": "other",
    "waste_kind": "general",
    "pet_waste_status": "allowed",
    "bag_available": "unknown",
    "source": "field_survey",
    "source_ref": "SURVEY-2026-003",
    "source_date": "2026-10-10",
    "status": "active",
    "last_verified_at": "2026-10-10T00:00:00+09:00",
    "photo_url": "/photos/bins/hometown-clothes-box.jpg",
    "note": "운영자 현장 확인으로 배변봉투 가능. 위치는 운영자가 표시한 단지 지도를 위성사진에 맞춰 찍음 (오차 약 10~20m)",
    "created_at": "2026-10-10T17:10:00+09:00",
    "updated_at": "2026-10-10T18:00:00+09:00"
  }
]